headline,date
BTC Price Index and Live Chart -- CoinDesk 20,2021-05-26
"CoinDesk: Bitcoin, Ethereum, Crypto News and Price Data",2021-05-26
Bitcoin Outflow From Exchanges Suggests Confidence Crypto Rout Is Over,2021-05-26
BTC Price Index and Live Chart -- CoinDesk 20,2021-05-26
Hedge Fund Billionaire Ray Dalio: 'I Have Some Bitcoin',2021-05-24
Bitcoin 101,2021-05-26
Convert Bitcoin into any World Currency,2021-01-05
BCH Price Index and Live Chart -- CoinDesk 20,2021-05-26
CoinDesk,2021-05-26
Bitcoin Plummets to Below $40K,2021-05-19
DOGE Price Index and Live Chart - CoinDesk,2021-05-26
CoinDesk,2021-05-26
"Market Wrap: Bitcoin, Ether Climb on 'Green' Mining Plans Before Losing Steam",2021-05-26
CoinDesk 20 Digital Assets and Cryptocurrencies,2021-04-27
Chapters Archive,2021-05-26
WBTC Price Index and Live Chart - CoinDesk,2021-04-12
"Huobi Scales Back Due to China Crackdown; Bitcoin Falls Below $32K, Ether Past $2K",2021-05-23
ETH Price Index and Live Chart -- CoinDesk 20,2021-05-26
Bitcoin Price,2021-05-26
XRP Price Index and Chart -- CoinDesk 20,2021-05-26
ADA Price Index and Live Chart - CoinDesk 20,2021-05-26
Bitcoin Mining Council: A Trojan Horse for Centralization?,2021-05-25
XLM Live Price Index and Chart -- CoinDesk 20,2021-05-14
LTC Price Index and Live Chart -- CoinDesk 20,2021-05-14
Watch on CoinDesk TV Live -CoinDesk,2021-02-08
BSV Price Index and Live Chart,2021-05-14
Coindesk,2021-05-26
Podcasts: Bitcoin and Crypto News Roundups,2021-05-26
Bitcoin for Advisors,2020-12-31
"Omkar Godbole, author at Coindesk",2021-05-26
BTG Price Index and Live Chart,2021-05-26
BTC Price Index and Live Chart -- CoinDesk 20,2021-05-26
Bitcoin at 10,2019-02-11
Bitcoin Venture Capital Funding,2018-11-14
Bitcoin Price Index,2021-05-26
Bitcoin Volatility,2021-05-26
A Reading of Satoshi's Bitcoin White Paper,2021-01-25
Over $20K? Why Is Bitcoin Worth Anything at All?,2020-12-16
What We're Getting Wrong About Druckenmiller and Bitcoin,2020-11-15
How Investors Can Gain Crypto Exposure Through Stocks,2021-05-25
"Bridgewater's Ray Dalio Softens Stance on Bitcoin, Says It Has Place in Investors' Portfolios",2020-12-09
"Market Wrap: Ethereum Classic Steals Show From Bitcoin, Ether, Even DOGE",2021-05-05
"Dalio, Brainard, Lummis: Your Guide to Day 1 at Consensus 2021",2021-05-24
China Mining Restrictions Good for Bitcoin: Bobby Lee,2021-05-25
"Bitcoin Back to $42K, Nearly Recovers Wednesday's Losses",2021-05-20
Bridgewater's Dalio Sees Governments Banning Bitcoin Should It Become 'Material',2020-11-11
Bitcoin in Cuba: A Local YouTube Influencer Explains How It Works,2020-08-21
Shark Tank's O'Leary Doubles Down on 'Green Bitcoin',2021-05-24
Hedge Fund Billionaire Ray Dalio Has Officially Bought Bitcoin,2021-05-24
"MicroStrategy's Saylor Details Meeting Where Bitcoin Mining Council Formed With Musk, Miners",2021-05-26
Bitcoin Price: Still Room to Fall?,2021-05-26
"Bitcoin News Roundup for May 27, 2021",2021-05-26
Bitcoin Jumps After Michael Saylor and Elon Musk Say They're Spearheading a 'Green Mining' Initiative,2021-05-26
"Bitcoin News Roundup for May 24, 2021",2021-05-24
Lummis' Financial Innovation Caucus to Launch Tuesday,2021-05-24
Bitcoin Consolidates; Faces Resistance Near $42K,2021-05-26
Bitcoin Mining Council,2021-05-26
Chinese Bitcoin Mining Company Invests $25M in New Facility in Texas,2021-05-20
JPMorgan to Let Clients Invest in Bitcoin Fund for First Time: Sources,2021-04-26
Elon Musk's Tesla Sold Bitcoin in Q1 for Proceeds of $272M,2021-04-26
Ripple Waiting for SEC Suit Resolution Before Going Public,2021-05-26
Ethereum Scaler Arbitrum Is Launching Friday With Developer Support From Alchemy,2021-05-26
Bitcoin Breaks Below $42K; Next Support at $34K as Intermediate Trend Turns Bearish,2021-05-19
How Does Bitcoin Work? Here's a Simple Explanation,2014-01-09
Por que el precio de bitcoin no caeria por debajo de $48.000,2021-03-10
XBX: CoinDesk's Bitcoin Price Index,2021-05-03
"Bitcoin, Ether Now Down 50% From Last Month's ATH as Rout Resumes",2021-05-23
"DeFi 'Raises Challenges' for Investors, SEC's Gensler Says",2021-05-26
Bitcoin Options Market Faces Smallest Expiry of Year,2021-05-26
Michael Saylor: Mining Council Will 'Defend' Bitcoin Against 'Uninformed' and 'Hostile' Energy Critics,2021-05-25
Fairlead's Stockton Plans to Add Bitcoin Exposure Only After Key Indicator Turns Higher,2021-05-26
Bitcoin Spikes to New Record High Over $61K,2021-03-13
"SEC Starts Official Review of SkyBridge, Fidelity Bitcoin ETF Applications",2021-05-26
"Number of Bitcoin Holders Shoots to Record High, Data Shows",2021-05-25
Fidelity Bitcoin Fund Attracts $102M in First 9 Months,2021-05-26
"Market Wrap: DeFi Token Yearn.Finance Pops 76% as Bitcoin, Ether Make Double-Digit Gains",2021-05-24
Why China's Crackdown May Make Bitcoin Mining More Centralized,2021-05-26
"Consensus Day 3, Recapped: Digital Money Battles",2021-05-26
"Bitcoin Rises, Faces Resistance Near $40K-$45K",2021-05-26
bitcoin.com,2020-06-02
Sichuan Energy Regulator to Meet to Discuss Bitcoin Mining: Report,2021-05-26
"Bitcoin Blasts Past $34K for First Time, Hours After Blowing Through $30K",2021-01-02
"Bitcoin, Ether Bounce After Disastrous Week for Crypto Market",2021-05-24
"Market Wrap: Ether Trading Volume Up, Closing In on Bitcoin; Crypto Market Struggles",2021-05-25
"DBS Says Bitcoin Affects Stock Markets, Is 'No Longer Fringe Asset'",2021-05-26
Bitcoin Rises Above $40K as Mining Council Plans to Address Environment Concerns,2021-05-26
Consensus 2021: 7 Questions for Bitcoin Anarchist Eric Voskuil,2021-05-26
Sacramento Kings to Offer Bitcoin Salary Option to All Players,2021-04-06
Bitcoin Struggles at Resistance; Support at $35K,2021-05-25
Bitcoin se recupera de su caida y alcanza los $50K,2021-02-16
"From $900 to $20,000: The Historic Price of Bitcoin in 2017",2017-12-29
Institutional Bitcoin Buying Spiked Around Wednesday's Crash,2021-05-21
David Z. Morris: Learning to Love the Bitcoin Mining Council,2021-05-25
Sour Sentiment on Wall Street Accelerated Bitcoin's Plunge,2021-05-19
Bitcoin Holds Short-Term Support; Faces Resistance at $40K,2021-05-24
SEC Starts Decision Clock on VanEck's Bitcoin ETF Application,2021-03-18
MicroStrategy apuesta otra vez por bitcoin y compra $1000 millones,2021-02-24
Bitcoin Stabilizes at Support; Faces Resistance at $45K,2021-05-21
Institutional Crypto Exchange LMAX Digital Hit Record $6.6B Volume on Bitcoin's 'Black Wednesday',2021-05-24
"Bitcoin Mining Council 'Isn't the Start of OPEC,' Member Says",2021-05-25
MicroStrategy CFO Says Tech Companies Have an 'Imperative' to Hold BTC,2021-05-24
Bitcoin Rises to Near $40K After Musk Tweets About BTC Mining's 'Promising' Renewable Usage,2021-05-24
What is a Bitcoin User? The Answer Isn't So Simple,2021-05-26
Why Selling a Tesla for Bitcoin Makes Even Less Sense Now,2021-05-24
Sam Bankman-Fried Says Bitcoin Mining Council Opens an 'Interesting Can of Worms',2021-05-25
Why Tesla's Reversal Is Good for Bitcoin,2021-05-16
"Bitcoin at Risk of Correction to $42K, Technical Analyst Says",2021-05-12
Bitcoin Sell-Off Could Stabilize Around $42K Support,2021-05-13
Bitcoin 101,2021-05-26
Asset Manager One River Files for Carbon-Neutral Bitcoin ETF in US,2021-05-24
"Bitcoin Suffers Biggest Pullback of 2021, to 3.5-Month Low",2021-05-17
David Z. Morris: Of Course China Is Anti-Bitcoin,2021-05-24
"Bitcoin, Ether Dive While Some Alternative Cryptocurrencies Hit Record Highs",2021-05-15
Bitcoin Plunges as Tesla Halts BTC Payments Over Environmental Concerns,2021-05-13
Bitcoin podria verse afectado por la recuperacion del empleo en Estados Unidos,2021-03-05
Bitcoin Plunge Below $40K Triggers $2B in Liquidations,2021-05-19
"Bitcoin Holds Support, Faces Resistance at $58K-$60K",2021-05-07
The Pattern in Bitcoin Volatility,2021-04-25
Why Bitcoin's Taproot Upgrade Matters,2021-05-09
Bitcoin Price Drops as Turkey Bans Crypto Payments Amid Currency Crisis,2021-04-16
Canadian Bitcoin ETF Provider Went on High Alert as Crypto Crash Halted Futures Trading,2021-05-21
Bitcoin's Potential as a Collateral Class,2021-05-02
Bitcoin Transactions Are More Expensive Than Ever,2021-04-21
MoneyGram to Allow Bitcoin Buying and Selling Across Retail Network,2021-05-12
Michael Casey: Iran's Bitcoin Bet and the Money Wars to Come,2021-04-30
Market Wrap: Bitcoin Hits $57K After $4.2B Options Expirations; Ether Steadies at $2.7K,2021-04-30
Crypto Exchanges See Most Bitcoin Inflows Since March 2020,2021-05-18
"Ark Investment's Cathie Wood Says Bitcoin Will Go to $500,000",2021-05-19
India's Millennials Embrace Bitcoin Despite Proposed Ban,2021-03-29
"As Bitcoin Newbies Panic, Old Pros Appear to Buy the Dip",2021-05-17
Marathon Miners Have Started Censoring Bitcoin Transactions; Here's What That Means,2021-05-07
"Nic Carter: The Frustrating, Maddening Bitcoin Energy Debate",2021-03-05
Elon Musk Says Tesla Is Suspending Bitcoin Payments Over Environmental Concerns,2021-05-12
Bloomberg Foresees Bitcoin Rallying to $400K This Year,2021-04-07
"As Bitcoin Gyrates, Options Traders Bet on Calm-Down",2021-05-24
Market Wrap: Elon Taketh Away - Bitcoin Continues Fall as Options Traders Pile Into Puts,2021-05-17
Bitcoin Struggles Near Resistance; Could Find Support at $55K,2021-05-12
"Greenpeace Stops Accepting Bitcoin Donations, Cites High Energy Use",2021-05-21
Bitcoin Stabilizes at Support; Faces Resistance Around $50K,2021-05-18
Bitcoin Falls as Chinese Official Calls for Mining Crackdown,2021-05-21
Market Wrap: Bitcoin Stays Near $55K as Ether Hits Brand-New Record Price,2021-04-28
"Bitcoin Price Falls $8K to 3-Week Low, Altcoins Crash",2021-04-18
Bitcoin Stalls at Resistance; Could Face Lower Support at $56K,2021-05-10
BlockFi Botches Promo With Outsized Bitcoin Reward Payments,2021-05-19
Bitcoin Outflows From Exchanges Aren't the Bullish Signal You Think,2021-04-04
Market Wrap: Bitcoin Over $55K as Ether Hits New All-Time High,2021-04-27
"Market Wrap: Capitulation City as Bitcoin Dumps to $31K, ETH to $2K Before Reversal",2021-05-19
Market Wrap: Bitcoin Steadies After $300B Market Cap Dump on Taxation Trepidation,2021-04-23
E-Commerce Giant MercadoLibre Discloses $7.8M Bitcoin Buy,2021-05-05
Want to Buy a Tesla With Bitcoin? It Ain't Easy,2021-03-25
'Extreme Fear' in Bitcoin Market Amid Price Plunge,2021-05-18
"Bitcoin Snaps 5-Day Losing Streak, Climbs Above $52K",2021-04-26
The Bitcoin Fog Indictment Shows the Permanence of User Data,2021-05-04
Bitcoin Crash vs. Correction: Do You Know the Difference?,2021-04-30
Bitcoin Stabilizes After Sell-Off; Faces Resistance Near $53K,2021-05-14
"Despite Price Drop, Bitcoin's 'Fundamental Narrative Has Not Changed,' Stack Funds Says",2021-04-22
Bitcoin Miner Argo Blockchain Purchases Hydro-Powered Data Centers in Canada,2021-05-13
Bitcoin Trades at $40K as Rebound Rally Stalls,2021-05-20
"MicroStrategy: Another Dip, Another $10M Bitcoin Purchase",2021-05-18
Bitcoin Breaks Below $50K as Market Sell-Off Continues,2021-04-23
Bitcoin Stabilizes After Pullback; Faces Resistance at $57K,2021-05-11
"Market Wrap: Bitcoin Price, Dominance Slips; Ether Hits Fresh Record High Over $2.6K",2021-04-22
The Myths and Realities of 'Green Bitcoin',2021-04-01
"Bitcoin Adoption Keeps Growing During Alt Season, Blockchain Data Shows",2021-05-12
"Market Wrap: China Breaks Crypto as Bitcoin Falls to $36K, ETH Drops $300 in Two Hours",2021-05-21
"Bitcoin Holds Support, Faces Resistance at $60K",2021-05-03
"Bitcoin Drops After Musk Suggests Tesla May Sell Holdings, Says It Hasn't Yet",2021-05-16
When Will Bitcoin's Taproot Upgrade Actually 'Lock In'?,2021-05-19
What Is Bitcoin Halving? Here's Everything You Need to Know - CoinDesk,2020-03-24
"Bitcoin Price Decline Deepens, Heads for Worst Week Since February",2021-04-22
Goldman Sachs Offering Bitcoin Derivatives to Investors,2021-05-06
Asian Video Game Publisher Nexon Buys $100M in Bitcoin,2021-04-28
"Market Wrap: Bitcoin Near $53K After Major Drop as Ether Tops $2,800 for First Time",2021-04-29
"With Bitcoin 'Bear Markets' Like These, Who Needs the Bulls?",2021-04-30
ETF Provider Teucrium Trading Files for a Bitcoin Futures ETP,2021-05-20
Bitcoin Options Market Eyes $4.2B in Expiries on Friday,2021-04-27
Bitcoin Taproot Upgrade Has Started Its Speedy Trial,2021-05-01
Bitcoin Holds Support; Faces Resistance at $50K,2021-05-17
"Bitcoin Price Plunge 'Feels Like Capitulation,' Says Novogratz",2021-05-19
Cryptocurrency Options Market Makers Influence Bitcoin Price,2021-05-14
"Market Wrap: Bitcoin Stuck Below $50K, and Blockchain Data May Show Why",2021-03-05
What Is the 'Kimchi Premium' for Bitcoin?,2021-04-06
Bitcoin Mining Difficulty Sees Largest Downward Adjustment of the Year,2021-05-01
Frances Coppola: Why Bitcoin Should Be Priced in Sats,2021-05-12
$623M in Bitcoin From 2016 Bitfinex Hack,2021-04-14
Nik Bhatia: Why $1 Million Bitcoin Is Coming,2021-03-01
JP Koning: You're a Lemon if You Buy a Tesla With Bitcoin,2021-03-29
Bitcoin Pullback Risk Rises as Whales Resume Selling,2021-05-11
Why It's Time to Pay Attention to Mexico's Booming Crypto Market,2020-08-13
Book Excerpt: Bobby Lee's Bitcoin Awakening,2021-05-18
How Accidents in Chinese Coal Mines Are Affecting Bitcoin Mining,2021-04-16
Microsoft Launches ION Decentralized Identity Network On Bitcoin,2021-03-25
Bitcoin Is Not a Stock,2021-03-17
MicroStrategy Buys $15M More of Bitcoin,2021-04-05
Nic Carter: The Virgin Bitcoin Fallacy,2021-05-11
Does Bitcoin Have an Energy Problem?,2021-04-22
"Ether, Hitting New Records, Now Gets Quoted in Bitcoin Terms",2021-04-29
"MicroStrategy Keeps Buying Bitcoin, Adds Another $15M",2021-05-13
Tesla Retreat Won't Stop Bitcoin: Bloomberg's McGlone,2021-05-13
Bitcoin Wallet Used by DarkSide for Ransom Payments ID'd by Elliptic,2021-05-14
OCC Warns of Fraudulent Emails Seeking Bitcoin Wallet Keys,2021-05-20
"Bitcoin Declines, on Track for Worst Month Since September",2021-04-29
"SEC Staff Hints at ETF Skepticism, Calls Bitcoin 'Volatile'",2021-05-11
Bitcoin Drops as Low as $53.5K in Quick Sell-Off,2021-05-10
How Backwardation Differs in Bitcoin and Oil Futures,2021-05-18
Ray Dalio Says He Has 'Some Bitcoin',2021-05-26
Bitcoin Chart Indicator Suggests Worst of Pullback May Be Over,2021-05-18
"Everything We Want Costs Energy, Including Bitcoin",2021-04-22
CME Climbs to 2nd Place in Bitcoin Futures Exchanges,2021-05-21
Revolut's UK Users Can Finally Withdraw Their Bitcoin to Personal Wallets,2021-05-05
Bitcoin Makes Weak Bounce After Tesla Blow but Pullback May Not Be Over: Analyst,2021-05-13
AXA Switzerland Allows Customers to Pay in Bitcoin,2021-04-15
Bitcoin Is Worth $1T and OKCoin Delists BCH and BSV,2021-02-19
"Bitcoin's Drop on Biden's Proposed Tax Hike Just Temporary, BCB CEO Says",2021-04-23
"DeFi More Disruptive to Banks Than Bitcoin, Says ING",2021-05-06
"Ray Dalio, Wall Street's 'Oddest Duck,' Shares the Bitcoin Mind",2021-05-21
Blockstream Buys Demeester's Adamant in Expansion Into Bitcoin Investment Products,2021-05-22
Bitcoin Options Traders Leaning Bearish Despite Price Recovery,2021-05-06
How to Buy Bitcoin at an 80% Premium From Michael Saylor,2021-03-03
"Peter Thiel's Palantir Now Accepts Bitcoin Payments, 'Thinking' About Treasury Investment",2021-05-11
This Indicator Suggests Bitcoin Is Overdue for a Big Price Move,2021-04-08
Market Wrap: Bitcoin Bounces to $54K as Ether Fees Drop Below Average in Past Week,2021-04-26
"Bitcoin Remains Under Pressure, Faces Resistance At $45K",2021-05-20
Bitcoin's 'Rich List' Shrinks Amid Continued Price Rally,2021-03-18
Bitcoin and Inflation: Everything You Need to Know,2021-01-28
Market Wrap: Bitcoin Near $59K as Worries on Bond Yields Increase,2021-03-19
Staff at Biggest Dutch Domino's Pizza Franchise Can Now Be Paid in Bitcoin,2021-05-22
UK Court Will Let Craig Wright Serve Claims Against 16 Bitcoin Developers,2021-05-12
Is Dogecoin the Next Bitcoin? Probably Not (But That's OK),2021-04-16
"Bitcoin Price Jumps 9%, Most Since Early March",2021-04-26
MassMutual Buys $100M in Bitcoin and $5M NYDIG Stake,2020-12-10
"Morgan Stanley Bitcoin Fund Draws $29.4M in 2 Weeks, Filings Show",2021-04-22
"Bitcoin, Ether Hit New All-Time Highs on Eve of Coinbase Listing",2021-04-13
Nic Carter: The Last Word on Bitcoin's Energy Consumption,2020-05-19
Bitcoin's Mining Difficulty Hits New High; Taproot Begins Second Attempt,2021-05-13
Tether Premium to US Dollar Returns in Bitcoin's Latest Sell-Off,2021-04-20
Bitcoin Is 'Too Important to Ignore': Deutsche Bank Report,2021-03-18
ECB's Panetta Claims Bitcoin Threatens Global Sustainability Efforts,2021-05-11
MicroStrategy Says Some of Its Board Directors to Be Paid in Bitcoin,2021-04-12
"CCN offers Breaking Crypto News, Prices & Charts!",2018-03-29
Bitcoin is All Grown Up and the Future is Bright,2020-09-28
Bitcoin Price Approaches $60K: What to Keep an Eye Out For,2021-05-05
Bitcoin Uptick Leads to Growth in Daily Transactions,2021-04-13
"Bitcoin Price Hits Two-Week Low, Garnering Interest from Small Investors",2020-05-25
How the Miners are Faring So Far,2020-07-06
What Is The price Of Bitcoin? Bitcoin Price And Analysis!,2021-05-01
Experts Explain the Benefits of Bitcoin,2018-09-06
Cryptocurrency Price Round-up: Dogecoin Soars while Bitcoin Rebounds,2021-04-19
What is Bitcoin? How Does It work? Learn It All Right Here!,2021-01-01
Darknet Bitcoin Mixer BestMixer Secures Website with TOR,2019-02-25
Bitcoin Soars Above $9K Mark with Strong Momentum,2020-04-30
Bitcoin (BTC) Soars 10% on Strong Momentum,2020-03-24
Bitcoin News Archives,2021-05-01
"Ankit Singhania, Author at Crypto Currency News",2021-05-01
Why Experts Recommend Investing In Bitcoin,2018-08-21
Crypto Currency News,2018-06-25
"Bitcoin gold, silver and copper coins and defocused printed circ",2018-09-25
Bitcoin Price Manipulation,2018-05-24
Why Goldman Sachs is Wrong About Bitcoin,2020-06-02
Bitcoin Cash Archives,2021-05-01
Hacker who sold users data for 2.6M$ in Bitcoin-1,2018-05-28
How to Prevent Bitcoin Fraud by Securing Your Identity,2020-06-19
Computer keyboard with bitcoin buttons buy sell graphite,2019-05-15
Coronavirus Outbreak: How Bitcoin is Faring So Far,2020-03-24
Is Bitcoin (BTC) a Buy After the Recent Market Sell-Off?,2020-03-19
Bitcoin - bit coin BTC cryptocurrency money burning in flames and fire sparkles,2018-03-06
Bitcoin Slumps as Crude Oil Crashes,2020-04-21
3 Altcoins That Have Potential To Be The Next Ethereum Or Bitcoin 3,2017-07-03
Crypto Currency News,2017-11-30
"Bitcoin Fan Holds Up Sign During Yellen's Testimony, Receives Donations of $100,000 For Effort",2017-10-31
Bakkt is All Set to Introduce Bitcoin Futures in September,2019-09-09
Crypto Currency News,2018-02-26
Are We Standing At the Top of a Bitcoin Bubble?,2018-01-13
BTC Price Offers a Buying Opportunity,2018-06-01
"Today's Market Leaders and Deceivers - BTC, BCH, ETH",2019-03-14
Bitcoin-Gold-price-chart-05-24-18,2018-05-24
"Crypto Market Top Ten Green - BTC, BNB, XLM",2019-04-01
How to Protect Your Bitcoin Wallet,2020-07-13
Bitcoin Will Be Worth 30k By End Of Year,2018-03-26
Check Out These Places That Accept Bitcoin!,2018-04-30
"Says Bitcoin Bears are Analyzing Bitcoin Incorrenctly, How so?",2018-06-05
Places Bullish Bet On Bitcoin Price But Success Is Doubtful,2018-03-13
Hand with mobile smart phone and bitcoin symbol,2017-11-29
Bakkt to Launch Institutional Bitcoin Custody Services,2019-11-12
How high does Bitcoin's prices have to reach before the typical Bitcoin investor sells it,2017-11-17
U.S. Regulators Step In and Launch Criminal Probe,2018-05-24
Bitcoin Richard Branson (Copy),2017-11-07
Will the Oversupply of Bitcoin Burst the Bubble One Analyst Says Yes,2017-11-28
Bitcoin (BTC) and Ethereum (ETH) Plummet Due to Coinrail Hack 'FUD',2018-06-11
Golden Bitcoin coin on the laptop keyboard. stock market graph. Trading concept,2017-11-07
Bitcoin Cash Will Be Available on HTC's Blockchain Phone,2019-09-17
Bitcoin Cash Hard Fork Approaches,2018-11-13
Bitcoin Rally Up 13% For The Day,2018-01-08
Numbers turning into golden bitcoin sign. Blockchain concept. 3D illustration,2017-12-05
"Bitcoin is Akin to Gambling, Causing Egypt to Ban It",2018-01-04
Ethereum (ETH) Falls 86% Relative to Bitcoin Since the 2017 Build-Up,2019-07-26
KFC Canada Now Accepting Bitcoin As Payment,2018-01-12
Bitcoin Miners Diversifying from China to the US over Regulatory Concerns,2019-06-07
Wall Street Says HODL and Abra CEO Says BOOM,2018-03-28
Did You Know Rapper 50 Cent Made Millions Off Bitcoin-1,2018-01-24
The Downside Potential Is Greater Than the Upside Trend,2018-03-06
BCH/USD Heads For Upside Break,2018-06-08
Stack of Bitcoin coins on Indian flag. Situation of Bitcoin and,2018-01-19
Bitcoin Reaches its One-Month High,2018-04-23
Golden bitcoin with dollar background. conceptual image for crypto currency.,2018-01-16
Bitcoin (BTC) Drops Below $5K Despite US Fed Slashing Interest Rates,2020-03-17
Word blockchain made of Bitcoin signs. 3D illustration,2017-11-01
Sir Jon Cunliffe Bitcoin is No Threat to the Worldwide Economy,2017-12-01
Bitcoin rocket and graphs,2018-08-18
South Africa Now Allows Traffic Fines to be Paid by Bitcoin,2017-12-06
"Bitcoin ""Exists Because of the Abuses""",2018-07-09
Crypto Currency News,2018-04-12
Bitwise Withdraws Bitcoin ETF Application with SEC,2020-01-15
Crashed In The First Quarter So What's Next?,2018-04-02
"Maria Ohle, Author at Crypto Currency News",2021-01-01
"Is Bitcoin Safe? Tim Draper, Renowned Investor: It's Safer Than Fiat",2018-05-14
bitcoin coin with money,2017-12-06
Bitcoin ABC Listed as Real Bitcoin Cash by OKEx,2018-12-12
"Bitcoin Price Watch - BTC/USD Surpasses $11,500, Upside Confirmed",2018-03-05
Study Finds One-In-Four Millennials Ditching Stocks For Bitcoin-1.,2017-11-09
Why It Isn't Living Up To Expectations,2018-02-06
Brian Kelly Tells CNBC Watch for Rising Price,2019-05-22
3d bitcoin Russia flag,2017-12-08
Bitcoin Just Made The US Olympic Winklevoss Twins Billionaires,2017-12-04
"Stops Naming BCH as ""Bitcoin"", Possible Lawsuit Beckons",2018-05-01
CME Bitcoin Options Eclipses Bakkt With a Strong Start,2020-01-14
Bakkt Bitcoin Options Trading Volume for Last Week was Just Zero,2020-01-30
Could Bitcoin Really See a 70% Uptrend?,2018-05-09
Bitcoin Bull Dan Morehead Predicts BTC to Hit $42K By End of 2019,2019-07-25
"Unlocking Cryptocurrencies: Growth, Opportunities and Limitations",2021-04-22
BTC's Sudden Spike Leaves All Puzzled,2019-04-05
"Bitcoin Cash Price Watch - BCH/USD Breaks Below Support, Drops To $1,110",2018-06-06
Bitcoin Mining in Norway and the State of the Crypto Market,2018-11-22
"Bitcoin Cash Price Watch - BCH/USD Holds Steady Around $1,100",2018-06-04
Sells $140m worth of Bitcoin - BTC Price Doesn't Drop,2018-05-01
"Bitcoin Cash (BCH) Gains Momentum, Soars 16% on High Volume",2020-02-06
Bitcoin Cash (BCH) Climbs Higher After Halving Event,2020-04-09
Bitcoin Mining Operations Cause Blackouts,2017-12-11
Crypto Currency News,2018-02-06
Which Online Stores Accept CryptoCurrency?,2018-07-05
Golden bitcoin coin on us dollars.,2017-12-13
Will BTC Rally Through $6300?,2018-06-28
Bitcoin Suddenly Crashes 8% as Momentum Fades After the Recent Rally,2020-02-20
Libra Exec Boasts Project's Benefits Over Bitcoin at CES 2020,2020-01-08
Bitcoin Price Chart 06-08-2018,2018-06-08
Bitcoin Price Ended Last Week in The Red,2018-03-12
Bitcoin Halving is Coming Soon,2020-04-16
Bitcoin Included on AML Regulations,2018-04-05
Bitcoin (BTC) Classified as an Asset by Morgan Stanley,2018-11-01
"Chainlink (LINK) Leads, Bitcoin Stands in 6th Position",2019-08-22
Shipping Giant to Create Locker Banks,2018-02-02
"Golden bitcoin coin hard fork in fire flame, lightning and water splashes.",2018-01-31
bitcoin feature (Copy)-min,2018-02-28
Mining Will Cost 0.5% of World's Energy,2018-05-18
UK Regulators Acceptance Could Lead to a Long Bull Run,2018-04-24
Only 10 Cents for $194 Million on the Bitcoin Network,2018-10-17
Bitcoin Futures CME Trading Generates $100 Billion in Volume Since 2017,2020-01-31
Price Jumps Above $8K Mark Again,2019-05-15
Bitcoin mining USB devices on a large USB hub.,2017-11-01
Bitcoin Price Will Take Decades to Stabilize,2018-05-30
"Bitcoin (BTC) Soars to 4-Month High, Crosses $10K Mark",2020-02-10
"6,000 Bitcoin Stolen but BTC Price Remains Steady",2018-09-20
Bitcoin or Gold Why Investors Should Consider Both in the Current Market,2018-01-20
"Bitcoin Is Not A Bubble, Here's Why",2017-11-11
Wall Street Ready For Bitcoin Futures Introduction-1.,2017-11-14
bitcoin chart 06 20 2018,2018-06-20
Russia to Avoid US Sanctions with $10 Billion Bitcoin Investment,2019-01-14
Does Bitcoin Breakout Signal More Rallies to Come Later this Year?,2019-07-09
Bitcoin Cash Hard Fork | Segwit Recovery & Schnorr Signatures,2019-05-15
"Bitcoin Price to Hit $7,200 After Demonstrating Bullish Signs?",2019-05-09
"Bitcoin Fell below $10,000 Mark - Here's Why?",2018-01-17
Blockchain Is the Real Answer,2018-06-25
CME Group to Launch Bitcoin Options in Early 2020,2019-09-23
BTC Surges Amid Economic Uncertainty,2019-08-06
CBOE Bitcoin (BTC) Futures Reach Record-Low Volatility,2018-11-06
Bitcoin-price-chart-05-22-18,2018-05-22
Bitcoin Soars 50% So Far in 2020,2020-02-14
"FCoin Closes Down, Reveals $130 Million Bitcoin Shortfall",2020-02-18
"Martin Banks, Author at Crypto Currency News",2021-05-01
Bitcoin (BTC) Soars Above $8K Mark on Geopolitical Concerns,2020-01-08
How the Bitcoin Halving Could Affect BTC Price in the Near-Term,2020-03-09
Coronavirus Outbreak Tests Bitcoin Safe Haven Status,2020-02-28
Bitcoin Hits $9K on Strong Momentum,2020-01-28
Bitcoin Tanks to $6K Mark on Economic Damage from the Coronavirus,2020-03-12
Bitcoin Jumps to 2-Month High on CME Futures and Options Boost,2020-01-15
Bitcoin Set For Breakout Amid Escalating Iran Tensions,2020-01-06
Bitcoin's 2017 Boom Largely Fueled by a Single Trader,2019-11-04
CME Sees Second-Best Month for Bitcoin Futures Trading,2020-02-13
Here are Key Factors to Watch in Q1,2020-01-02
Bitcoin Corrects 45% from Highs,2019-11-28
