headline,date
Bitcoin Recovers as Coronavirus Pandemic Continues to Hurt Markets,2020-03-03
Bitcoin SV Soars on Rumors: Will the Real Nakamoto Please Stand Up?,2020-01-14
Bitcoin (BTC) Suddenly Tumbles Below $7K Mark,2019-12-17
Bitcoin Price Gains as China Scraps Crypto Mining Ban,2019-11-06
Bitcoin SV (BSV) Jumps Another 28%,2020-01-10
Bitcoin Adjusted Dominance Soars,2019-08-23
Bitcoin in Bull Territory? Some Analysts aren't Sure,2019-10-29
Bitcoin.com Listing Despite Community Hesitations,2019-12-16
"Bitcoin Continues to Face Hurdles at Higher Level, Altcoins Follow",2019-08-20
Safeway Partners with Lolli to Give BTC to Customers,2019-07-26
Is the Bottom Finally in Sight?,2019-11-19
"Bitcoin Extends the Fall, Now at One-Month Low Below $8K",2019-11-21
Bakkt to Launch Cash-Settled Bitcoin Futures on December 9,2019-11-22
Bitcoin Mining Equipment Demand is Exceeding Supply,2019-06-25
Bitcoin (BTC) to Gain More Strength Above $12k Mark,2019-07-04
The Ultimate Guide to Getting Payments with Bitcoin,2019-09-04
Litecoin and Bitcoin Slump Despite Bakkt's Anticipated Debut,2019-09-24
Hacker who sold users data for 2.6M$ in Bitcoin-2,2018-05-28
Bitcoin Transaction Worth $1 Billion USD Moved to Single Wallet,2019-09-06
Bitcoin Drops 30% in Two Weeks,2019-09-27
"Bitcoin fan who held up sign during Yellen's testimony receives $10,000 for his effort",2017-07-13
Bitcoin Hash Rate Hits 80 Quintillion for the First Time,2019-08-08
Bitcoin.com to Launch a Bitcoin Cash Supported Futures Contract,2019-09-16
Bitcoin Struggles to Hold the Rally,2019-07-30
Bitcoin Sinks to Five-Month Low Following Zuckerberg Testimony,2019-10-23
Altcoins Attempt to Build Gains After a Big Jump in Bitcoin,2019-10-30
Bitcoin Falls 30% from Highs,2019-08-01
Bakkt is All Set to Launch Options on Bitcoin Futures in December,2019-10-25
"Slim Chance of Bitcoin (BTC) Hitting $20,000 USD By End of Year",2019-08-27
Bitcoin Falls Below $10K Again,2019-07-23
Is Bitcoin (BTC) a Recession Proof Like Gold? Here's What Experts Think,2019-08-15
Computer keyboard with bitcoin buttons buy sell graphite,2019-05-24
Bitcoin (BTC) Recovers As Momentum Returns on Strong Technical,2019-07-03
"Bitcoin Tanks From Highs, But Still Up Significantly YTD",2019-10-02
Tom Less Says Bitcoin Bears are Wrong-2,2018-06-05
Bitcoin Price to Reach $55K? Joe Kernen Suggests So!,2019-07-29
Bitcoin Price Soars 7% as Bulls Find Support at Lower Levels,2019-09-03
Bitcoin Price Crosses the $11K Mark For the First Time Since March 2018,2019-06-24
Two New Cases Circulating the Media,2019-09-30
Is This Good or Bad for Crypto Traders?,2019-09-11
Bitcoin Cash Stabilize-2,2018-05-21
"New One Year High of Almost $9,000",2019-05-28
"Bitcoin Drops Below $10,000 USD in Sudden Swing",2019-08-28
Bitcoin Supply Now has 85% in Circulation,2019-08-01
Bitcoin Continues to Face Tough Hurdle on Trade War Concerns,2019-09-12
Bitcoin (BTC) Corrects 30% & Falls Below $10K,2019-07-02
"Bitcoin Could Fall Below $10,000 Mark As Altcoins Gain",2019-09-09
"Bitcoin (BTC) Price Continues the Bulls Run, Near 5 Digits Mark",2019-06-21
Bitcoin Miners Turn Profitable,2019-09-10
Golden bitcoin and indian rupee money.,2018-04-20
Bitcoin (BTC) up Nearly 20% in 48 Hours,2018-11-29
Bitcoin Price Jumps 20% on Technical Breakout,2019-04-02
Bitcoin Recovers Quickly on Technical Bounce,2019-07-18
Short Sellers Surprised as Bitcoin Surges Another 4.5%,2019-07-08
Market Rallying on First Golden Cross Since 2015,2019-04-23
Is the Current Bull Run Incentive to Buy in?,2019-05-29
Bitcoin Price Experiences Second Largest 24-Hour Drop of 2019,2019-07-17
Bitcoin (BTC) is Back in Momentum,2019-07-22
Is Nobody Spending Bitcoin? Chainalysis New Data Reflects Rally,2019-05-31
Why 2019's Rally is Different Than 2017,2019-08-06
The Most Common Misconceptions About Bitcoin,2019-05-30
"Bitcoin (BTC) Price Falls Below $8,000 On Panic Selling",2019-06-04
"Analysts Indicate BTC Could Drop to $4,000",2019-04-30
Bitcoin (BTC) Falls Back Again As Facebook's Libra Faces Huge Setback,2019-07-05
Chinese Investors Jump on Bitcoin's Bull Trend but at a Higher Price,2019-04-09
"BTC Extends Rally On Strong Momentum, Now What?",2019-04-03
Bakkt Announces Bitcoin Futures Launch Date in July,2019-06-13
"Holding Steady Near $3,800, Corrections Across the Market",2019-01-04
Bitcoin Price Surges to a New 2019 High,2019-04-24
Bitcoin Generation Suspension,2019-04-29
INDEXSP:.INX Archives,2021-05-01
You Can Be Paid in Bitcoin if You Want,2019-03-21
"Bitcoin (BTC), Ethereum (ETH), and Ripple (XRP) Crash",2018-09-05
Bitcoin Price is in the Green but EOS is Today's Real Winner,2019-04-10
What is Bitcoin Maximalism?,2018-06-20
What Is XBT and How Does It Relate To Bitcoin?,2018-06-26
Bitcoin Hits Lowest Level of the Year Thus Far,2018-11-14
A Month of Major Highs Followed By Many Lows,2018-08-14
Buy Bitcoin Cash Analysts Say,2018-05-03
Bitcoin Shows No Growth After Consensus 2018,2018-05-17
15 Bitcoin Facts You've Got to Read!,2018-03-16
Bitcoin Price Approached $20K in Dec. 2017 and Now It's At $3K,2018-12-17
Crypto Market Capitalization Hits New High,2019-04-15
"BTC is Bullish, are Altcoins the Reason?",2018-09-21
JPMorgan Claims Bitcoin Isn't Worth Mining Anymore,2019-01-25
Is This Why BTC Price is Dropping?,2018-06-08
Is The Price Fumbling Or Will We See A Crash?,2018-04-05
How Did Bitcoin Get Started? Who Started it?,2018-02-21
Bitcoin (BTC) Crash Causes Crypto Mining Closures and Bankruptcy,2018-11-23
The Psychology Behind Bitcoin (BTC) Price,2018-07-13
Cryptocurrency Makes a Comeback After Major Slump,2018-11-28
"Bitcoin Price Watch - BTC/USD Erases Gains, New Bearish Run Confirmed",2018-05-30
Last Year Things were Very Different!,2018-11-19
"Banks Must Embrace or ""Bite the Dust""",2018-11-16
First Block Capital Launches Canadian Bitcoin Mutual Fund,2018-09-11
Where Are The Cheapest Places For Mining?,2018-02-16
Analysts Are Calling it 'Worthless',2018-04-06
A List Of Ways You Can Actually Short Bitcoin!,2018-05-07
"NFL Strikes Crypto Deal; Bitcoin Drops Below $8,000",2018-07-31
ICE Forms Company to Bring Bitcoin Mainstream,2018-08-03
Reveals 82% of Institutional Investors Favor Bitcoin,2018-04-26
"It Could Hit $5,000 Level, Analysts Say",2018-03-15
Bitcoin Cash is the Biggest Loser,2018-05-17
Latest Bitcoin Scandal - What Happened in Singapore?,2018-04-13
Could It Plunge Another 50% Before Stabilization?,2018-04-04
Bitcoin Cash (BCH) vs. Bitcoin SV (BSV),2018-12-21
"Another Expert - Brian Kelly, Supports This Prediction.",2018-04-16
"BTC/USD Drops Below $7,000 - Keep Updated",2018-04-05
Bitcoin Cash Hard Fork Controversy,2018-11-19
Who Came Out Victorious?,2018-11-26
"Apple's Steve Wozniak Says Bitcoin has ""Massive Value Creation""",2019-02-27
Bitcoin Transaction Fees,2018-06-26
"Bitcoin Price Watch - BTC/USD Shows Signs of Reversal, Back Above $6,500",2018-06-15
Is it Game-Over for Bitcoin? Wall Street Analyst Thinks So,2018-08-10
"Tom Lee Sticks by His $15,000 Price Prediction",2018-11-21
Trust in a Decentralized Ecosystem,2018-09-04
"Bitcoin is not a Reliable Savings Option, Study Shows",2018-05-29
"Bubble Has Already Burst, Banks Says",2018-04-11
"Bitcoin Price Shows Resilience Above $3,500, Despite ETF Rejection",2019-01-24
Man Held at Gunpoint and Forced to Transfer His Bitcoin,2018-01-30
Warren Buffett Said It All Along,2018-11-23
"Bitcoin Price Watch - BTC/USD Declines Past $7,500, Holds New Support",2018-05-25
"Thomas Lee Thinks Bitcoin will Reach $25,000",2018-04-12
Joost van der Burgt Shares his Analysis,2018-06-04
What's Happening? Will It Bounce Back?,2018-02-05
Tom Lee Bitcoin Price Target Changed,2018-07-05
"Spencer Bogart Says Lower or Higher, Either Way it's Good",2018-12-18
Bakkt Announces Futures Launch Date!,2018-10-23
"Alibaba Founder, Jack Ma, Calls Bitcoin (BTC) a Bubble",2018-05-18
Abra CEO Believes It will Happen Soon,2018-09-04
Bitcoin Wallet Supporting the Lightning Network,2018-04-09
Selloff; Trend Makers Bashing Continues,2018-05-23
"Skyrockets Nearly 10%, Pulling Rest of Crypto Market Up",2018-10-15
Could Restaurants Create Mass Adoption?,2018-10-05
Through the Years the Roller Coaster Ride Continues,2018-04-09
BEWARE of the Bitcoin ATMs,2018-01-25
"Malta Warns of ""Get-Rich-Quick"" Scam",2019-01-25
"Bitcoin Price Watch - BTC/USD Holds Support, Volatility On The Decline",2018-06-08
Bitcoin Makes Massive 10% Gain in 24 Hours,2018-07-17
Bitcoin Cash Price Falls to 3-Month Low,2018-06-13
"Analysts Defend Bitcoin, The Market Is Stable",2018-05-10
"Up 50% in April, Will May Bring Another Massive Uptrend?",2018-04-30
Golden bitcoin coin on us dollars close up. High resolution photo.,2017-12-07
How Bitcoin Could Become Irrelevant,2018-04-24
Are Spencer Bogart's Predictions True?,2018-07-27
"Bitcoin Private (BTCP), NEO, and Ethereum (ETH)",2018-05-01
Will Starbucks Make Paying with BTC Easier?,2018-08-03
PayPal Is Enabling Bitcoin and Crypto Withdrawals,2021-05-26
"Bitcoin, Ethereum and the future of finance",2021-05-26
Sichuan Energy Authorities to Discuss Bitcoin Mining Ban,2021-05-21
"Ray Dalio Owns ""Some Bitcoin"" as an Inflationary Hedge",2021-05-24
"Ethereum Has ""Much Higher Utility"" Than Bitcoin: Guggenheim Co-Founder",2021-05-25
Goldman Sachs Endorses Bitcoin as New Asset Class,2021-05-24
Coinbase Comments on Bitcoin's Ecological Impact,2021-05-25
"HSBC ""Not Into Bitcoin,"" Says CEO",2021-05-24
BlockFi Mistakenly Sends Users Large Bitcoin Payments,2021-05-19
Bitcoin Tumbles as China Issues Yet Another Threat,2021-05-21
Bitcoin Holders Show Signs of Optimism Despite 30% Dip,2021-05-20
"Bitcoin Drops Below $40,000, Over 40% off All-Time High",2021-05-19
Saturday Is Bitcoin Pizza Day: Here's How to Take Part,2021-05-21
Treasury Calls for $10K Bitcoin Transfers to be Disclosed to IRS,2021-05-20
"Long Bitcoin is World's ""Most Crowded Trade"": Bank of America Survey",2021-05-18
Ethereum Market Cap Now Half the Size of Bitcoin,2021-05-14
"Bitcoin Plunges, Rebounds on Elon Musk Tweets",2021-05-17
UBS Exploring Bitcoin Offerings for Wealthy Clients: Report,2021-05-10
"Facebook Didn't Buy Bitcoin, But Crypto Whales Did",2021-04-29
Crypto Market Tumbles After Tesla Halts Bitcoin Payments,2021-05-13
"Palantir Now Accepts Bitcoin, Mulling Investment: Report",2021-05-11
"After Bitcoin, Institutions Finally Turning to Ethereum",2021-04-29
"Bitcoin Is Coming to a US Bank Near You, Says NYDIG",2021-05-05
"Bitcoin Rests After Drop, Tests Buy-the-Dip Narrative",2021-04-21
"MoneyGram to Offer Bitcoin at 20,000 U.S. Kiosks",2021-05-12
Bitcoin Bounces Back But Faces Stiff Resistance Ahead,2021-04-26
"Three Reasons Why Bitcoin Dropped Below $51,000 Last Night",2021-04-18
"Tesla ""Tests Liquidity,"" Sells $272M Bitcoin",2021-04-27
"Central Bank of China May Regulate Bitcoin as ""Investment Alternative""",2021-04-19
"Bitcoin, Ethereum, and XRP Enter Downtrend With Few Signs of Slowing",2021-04-23
"Bitcoin Crashes After Accident in Xinjiang, China Halts Mining Operation",2021-04-16
Bitcoin and Ethereum Indices Debut on S&P Dow Jones,2021-05-04
Ark Investment Makes Its Case for a Greener Bitcoin,2021-04-22
"Bitcoin Breaks Critical Support as Ethereum, XRP Attempt Recovery",2021-04-21
BTC / USD Price Analysis: Bitcoin On The Run,2019-05-13
Lightning Network Integration Now Lets Counter-Strike Players Earn Bitcoin,2020-12-28
$26M in Bitcoin From the 2016 Bitfinex Hack on the Move,2020-10-07
Can Bitcoin Be Shut Down? A Naysayer's Guide to BTC,2020-04-24
Who Controls Bitcoin? A Guide to BTC Stakeholders,2020-05-22
"Bitcoin Forks Explained, Which Ones Are Worth Claiming?",2020-04-02
Mt. Gox Creditors Will Soon Claim $4.9 Billion in Bitcoin,2021-01-15
"Bitcoin In Your Face: Buffeted From All Sides, BTC Survives And Thrives",2019-05-10
Multi-Billion Dollar Asset Fund Stone Ridge Reveals $115M Bitcoin Purchase,2020-10-14
"Stellar Lumens Is Breaking Out, Will Bitcoin Follow?",2020-04-28
Billionaire Hedge Fund Manager Stan Druckenmiller Buys Bitcoin,2020-11-09
"Ether Is Outperforming Bitcoin in 2020, and There's More to Come",2020-06-25
"Before India Enjoys Mass Adoption, It First Needs to Fix Bitcoin's Image",2020-05-06
Bitcoin Near-Term Outlook Favors Bulls as Stimulus Talks Resume,2020-11-20
Bitcoin And Copper: Two Assets Ringing Recession Alarms,2019-08-27
Bitcoin Bulls Continue to HODL as Optimism Returns,2020-04-04
"wNews: What Bitcoin at $50,000 Means for the Market",2021-02-19
Bitcoin Declared Legal Commodity In Chinese Court,2019-07-18
Goldman Sachs Plans Suite of Bitcoin Products for Q2,2021-03-31
Was Bitcoin Brought Down by a Chinese Ponzi Scheme?,2019-12-16
Dogecoin Will Be Available in Bitcoin ATMs Across America,2021-03-02
Bitcoin Could Drag Down Ethereum and XRP Ahead of Halving,2020-05-05
"Bitcoin Resumes Relentless Bull Run, Breaks $16,000",2020-11-12
Sotheby's Will Accept Bitcoin in Next Banksy Auction,2021-05-04
World's 6th Largest Bank Is Blocking Bitcoin Transactions,2021-01-11
Bitcoin's Birthday: Satoshi Nakamoto's Hidden Message Explained,2021-01-03
Bitcoin and Ethereum Face the Bears in Short-Term Correction,2020-12-10
The Fed's Stimulus Plans Put Bitcoin Back in the Spotlight,2020-03-23
"Bitcoin Prepares to Set New 2020 Trading High at $12,000",2020-10-20
"Bitcoin Jumps 4% Following Iran Airstrike, Safe Haven Asset?",2020-01-03
MicroStrategy Adds Another $15 Million Bitcoin,2021-03-01
How to Mine Bitcoin: Complete Guide For Beginners,2020-04-25
Visa Is Planning To Enable Cryptocurrency Transactions,2021-03-17
"Bitcoin Decimates Bears With Quick Recovery Above $19,800",2020-11-30
"JP Morgan Backs 1% Bitcoin Allocation, Suggests Uncorrelated Hedge",2021-02-26
Almost $1 Billion in Bitcoin Just Came Out of Hibernation,2020-11-03
"Bitcoin, Gold Gain as Fed Prints ""Infinite Amount of Cash""",2020-03-25
"Bitcoin Breaks New All-Time Highs Targeting $23,000",2020-11-30
"Chinese Bitcoin Miners Hesitant to Trade. Otherwise, It's Business as Usual.",2020-11-24
Could Bitcoin Benefit from a Weaker U.S. Dollar?,2020-03-31
Chainalysis: $2.8B Bitcoin Laundered Through Exchanges in 2019,2020-01-16
Bitcoin Headlines Sour as Leading Cryptocurrency Corrects,2020-11-25
Why Bitcoin Is Awesome For Drug Dealers,2018-04-28
"You Don't Need to Report Bitcoin Buys Made in Dollars, Says IRS",2021-03-03
How Crypto.com Makes Buying Bitcoin Easy,2020-12-14
Can Bitcoin Survive Quantum Computers?,2019-07-11
Bitcoin Cash Companies Are Taking Sides; Mining Tax Will Die On Arrival,2020-08-25
"Institutional Investments Rise With Bitcoin Volatility. Wait, What?",2019-07-08
Bitcoin's Growing Hodl Culture,2020-01-07
From Refugees To Hedge Funds: Bitcoin's Universal Appeal,2019-09-09
How to Set Up a Bitcoin Node: A Beginner's Guide,2021-01-20
"UMA Protocol's New ""Yield Dollar"" Raises Security Concerns for Bitcoin in DeFi",2020-09-08
Strong Fundamentals Push Bitcoin to New Yearly High,2020-10-27
Institutions May Pin Million-Dollar Tags on Bitcoin. That Doesn't Mean It's Going to Happen.,2021-01-22
Bitcoin Hashrate Breaks New Record as Mining Booms,2021-01-13
Bitcoin Mining Energy Usage A ' Sensationalist Narrative' Says New Report,2018-06-06
"Institutions Rush to Bitcoin, Grayscale's Record-Breaking Q3",2020-10-14
Why Bitcoin? Bitcoin Versus Gold,2019-09-12
"What the Future Holds for Bitcoin, Analysts Weigh-In",2020-05-01
"Corporate Investment May Be About to Pump Bitcoin, Says Bill Miller",2021-01-06
Gemini Launches New Service for Bitcoin ETF Providers,2021-03-04
"Traders Find Hefty Gains Beyond Bitcoin in Ethereum, XRP",2020-12-07
"Bitcoin Jumps Above $10,000 as It Prepares for Next Bull Cycle",2020-06-02
BitMEX Will Introduce Bitcoin SegWit Support,2020-12-14
"SIMETRI Outperforms Bitcoin, Altcoins, and Crypto Funds with 750% ROI",2020-08-13
Bitcoin's Drop to $20K Resulted in $370M of Liquidations,2020-12-01
"Bitcoin Overtakes Tesla in Google Search Volume, Sparking BTC Bulls",2021-02-02
wNews: The 5 Phases of Bitcoin,2021-02-13
Bitcoin ETF Decision Postponed By SEC Until Sept 30th,2018-08-07
Public Overwhelmingly In Favor Of Bitcoin ETFs On SEC Website,2018-07-17
Are Bitcoin Mixers Going Quiet?,2019-08-07
Greenpro Stock Price Leaps by 103% With Bitcoin Buy,2020-12-28
"Bitcoin Eyes New Yearly Highs, Buy Pressure Skyrockets",2020-11-16
The Rise and Rise of Bitcoin Adoption,2020-01-29
SEC Says Bitcoin and Ethereum Are Not Securities,2018-06-14
Fidelity Investments Files Bitcoin ETF Application,2021-03-25
Is The CBOE Bored Of Bitcoin?,2019-06-10
Bitcoin Becomes 6th Most Valuable Asset in the World With $1 Trillion Market Cap,2021-02-19
"Elon Musk, Bill Gates, Apple's Twitter Accounts Hacked in Massive Bitcoin Scam",2020-07-15
"Sacramento Kings to Offer Bitcoin Salaries to Players, Staff",2021-04-06
Binance's Bitcoin-Pegged Token: Is BTCB Really Necessary?,2019-06-23
Bitcoin Market Cap Hits $100bn As Facebook Reveals Crypto Plans,2019-05-03
Bitcoin Reaches New Highs as Central Banks Hint at More Stimulus,2020-11-12
Grayscale Reveals Plans to Convert GBTC to Bitcoin ETF,2021-04-05
"No, China Didn't Ban Bitcoin Mining",2019-04-22
Institutions Crowding Out Retail With Bullish Bitcoin Predictions,2020-11-24
"Bitcoin Dipped Below $9,000, What's Next?",2020-05-22
Vitalik Calls Bitcoin SV A Dumpster Fire,2018-12-26
"Elon Musk: Bitcoin Close to Reaching ""Broad Acceptance""",2021-02-01
Bitcoin Plummets as CFTC and FBI File Charges Against BitMEX,2020-10-01
Square Inc. Hopes to Go Green With Bitcoin,2020-12-08
Coinbase Marks IPO With Memo on Bitcoin Blockchain,2021-04-14
Decred Is The Bitcoin You Wished BTC Could Be,2018-07-31
"Long Bitcoin, Short Dollar Trades ""Most Crowded,"" Says Bank of America Survey",2021-01-19
Will the Fed's New $2.3 Trillion of Credit Affect Bitcoin?,2020-04-10
Data Shows Ethereum Is Better Money Than Bitcoin,2020-04-29
Bitcoin Private Premine Blamed On Bug Exploit,2018-12-24
Bitcoin Bulls to Correct Before Reaching for Higher Highs,2020-10-26
Bitcoin Market Eyes Grayscale Premium as Unlock Looms,2021-02-03
Bitcoin Gold's Recent 51% Attacks Were Resisted by Counterattacks,2020-03-12
"BlackRock Could Buy Bitcoin Futures, SEC Filings Say",2021-01-20
JPMorgan May Launch a Bitcoin Fund This Summer,2021-04-26
Bitcoin Price Could Rebound Despite Flash Crash,2021-04-19
WeWork to Add Bitcoin to Its Balance Sheet,2021-04-20
"Bitcoin Takes Aim at $70,000 as Institutional Demand Skyrockets",2021-04-11
Grayscale GBTC and ETHE Premiums Back at Highs,2021-05-25
wNews: Biden's Tax Plan Shines Spotlight on Bitcoin Borrowing Services,2021-04-24
"Rothschild Investment Adds Ethereum, Surpassing Bitcoin Holdings",2021-04-16
Ethereum Staking Will Drop Power Consumption by 99%,2021-05-18
"BlackRock CEO ""Fascinated"" by Bitcoin, Watching Closely",2021-04-15
Bitcoin and Ethereum Could See a Liquidity Crisis,2021-04-07
TIME Will Invest in Bitcoin and Partner With Grayscale,2021-04-12
"Bitcoin to Become the Global Reserve Asset, Says Bloomberg",2021-04-07
Crypto Market Continues to Slide After Week of Chaos,2021-05-23
Bitcoin Bulls Back Free Speech Platform With $3.8 Million Investment,2021-04-21
"wNews: Bitcoin ""Threatens"" the Dollar, Says Peter Thiel",2021-04-10
"Bitcoin, Ethereum Make New All-Time Highs",2021-04-13
"Bitcoin, Ethereum, and XRP Are Primed for Higher Highs",2021-04-08
Market Volatility Liquidates More Than $600M in Bitcoin Positions,2021-03-31
JP Morgan Says Stable Bitcoin May Attract Institutions: Report,2021-04-02
"Bitcoin Targets Record Highs After ""Strongest Dip-Buying"" of the Year",2021-03-29
"Bitcoin, Stocks, and Gold Rise over the Dollar after Inflation Report",2021-04-13
Is General Motors Planning to Accept Bitcoin Payments?,2021-03-26
"Low Volatility Affirms $130,000 Bitcoin Target, Says JP Morgan Analyst",2021-04-05
HSBC Reportedly Blocking Investments in Key Bitcoin Advocate,2021-04-09
Morgan Stanley Registers Funds With Up to 25% Bitcoin Allocation,2021-04-01
Tesla Breathes New Life Into Bitcoin Bull Run,2021-03-24
GoDaddy Briefly Put Bitcoin.com Up for Sale By Mistake,2021-04-05
"Bitcoin, Ethereum Primed to Rebound Despite Losses",2021-03-25
Paxful Says Bitcoin Buyers Are Safe From Data Breach,2021-04-09
Goldman Sachs Registers Proxy Bitcoin Investment Product,2021-03-25
Is Tesla Preparing to Accept Tokens Other Than Bitcoin?,2021-03-25
"Bitcoin to Beat Gold Not Digital Dollar, Says Fed Chairman",2021-03-22
"Chipotle Will Run $100,000 Bitcoin and Burrito Giveaway",2021-03-30
"For Many in the Sex Industry, ""Bitcoin Is the Only Option""",2021-03-13
"CME Group to Launch ""Micro Bitcoin Futures"" Contracts for Retail Investors",2021-03-30
$5.5 Billion Worth of Bitcoin Options Expire on Friday,2021-03-23
Microsoft's ION Identity Layer for Bitcoin Is Now Live,2021-03-25
Bakkt Launches Its Bitcoin Payments App,2021-03-31
"Bitcoin, Ethereum May Recover With Strong Support",2021-03-15
Morgan Stanley to Offer Bitcoin to Their Richest Investors,2021-03-17
"Bitcoin Crosses $60,000, Setting a New All-Time High",2021-03-13
5 Key Takeaways From Bank of America's Bitcoin Report,2021-03-19
Microstrategy Purchases Additional 262 Bitcoin for $15 Million,2021-03-12
Jay Clayton Joins Bitcoin-Rich Asset Management Firm,2021-03-30
"Markets Lift Bitcoin, Leaving Ethereum for the Bears",2021-03-19
Bitcoin Prices Look Volatile After News of India Ban,2021-03-15
Mike Dalton,2021-05-26
Bitcoin Primed for New All-Time Highs as Retail Interest Returns,2021-03-03
SEC Receives Application for Balanced Equity-Bitcoin ETF,2021-03-11
Bitcoin May Retrace Shortly Before New All-Time Highs,2021-03-09
Bitcoin Rewards Program Lolli Lands $5M Investment,2021-03-24
"You Can Now Buy a Tesla With Bitcoin, Says Elon Musk",2021-03-24
SBI Holdings in Japan Announces Public Bitcoin Mining Pool,2021-03-19
What Is Bitcoin? Introduction To Digital Cash And BTC,2018-02-06
wNews: Unwinding the Grayscale Bitcoin Trade,2021-03-12
"Chia Hits $500 Million Valuation, Planning IPO",2021-05-25
"Surveys Indicate Inflow of Stimulus Checks to Stocks, Bitcoin",2021-03-17
Norwegian Industrial Giant Aker Creates Bitcoin Unit,2021-03-08
China's Inner Mongolia Cracks Down on Bitcoin Mining,2021-03-01
"Microstrategy Buys the Dip, Adds $10 Million Bitcoin",2021-03-05
"Energy Giant Plans to Use Bitcoin as an ""Economic Battery""",2021-03-09
"Bitcoin, Ethereum, XRP Poised to Resume Uptrend",2021-03-05
"Bitcoin, Gold, Stocks Rebound With Drop in U.S. Dollar",2021-03-09
Grayscale's Latest Job Posting Suggests Bitcoin ETF Plans,2021-03-10
"Economist Warns of ""Bitcoin Aristocracy"" Ruling the World",2021-02-27
Grayscale's Parent Company to Buy $250M Bitcoin via GBTC,2021-03-10
Shark Tank's Kevin O'Leary Reveals Move into DeFi,2021-03-02
"Goldman Sachs Cashes in, Re-Opens Bitcoin Trading Desk",2021-03-02
"Microstrategy, Square Become Repeat Bitcoin Buyers",2021-02-24
Bitcoin Lending Platform BlockFi Raises $350 Million,2021-03-11
Bitcoin Tech Company NYDIG Raises $200 Million,2021-03-08
"Veteran Investor Jim Rogers Regrets Not Buying Bitcoin, Fears Regulation",2021-03-03
Square Adds $170 Million Bitcoin to its Balance Sheet,2021-02-24
Yield Farmers are Migrating to Polygon,2021-05-21
"Carl Icahn Bullish Ethereum, May Invest $1.5B in Crypto",2021-05-25
"Citi Says Bitcoin Could Become ""Currency of Choice for International Trade""",2021-03-01
Proxy Bitcoin ETFs in the US Killing Grayscale Premium,2021-03-04
Solana Surges on News of Coinbase Pro Listing,2021-05-20
Cboe Exchange Submits SEC Application to List Bitcoin ETF,2021-03-02
Shark Tank's Kevin O'Leary Invests 3% of Portfolio in Bitcoin,2021-03-02
Cardano Close to Launching Smart Contracts: Charles Hoskinson,2021-05-22
"Mexico's 3rd Richest Man Reveals BTC Holdings as Bitcoin Breaches $18,000",2020-11-18
Fidelity's Global Macro Head Recommends Bitcoin Investment,2021-03-01
"Bitcoin Must Hold Above Crucial Support to Avoid Downswing to $40,000",2021-02-23
Bitcoin Is Now in Overbought Territory Following Elon Musk's Endorsement,2021-01-29
Goldman Sachs Flashes Buy Signal for Coinbase Stock,2021-05-24
Bitcoin Gold Correlation: Solutions for Economic Instability,2018-07-10
"Bitcoin Enters New Corrective Period, Bears Aim for $26,000",2021-01-21
"FTX, BitMEX Commit to Becoming Carbon Neutral",2021-05-21
Key Indicator Suggests Major Bitcoin Correction in the Works,2021-01-18
Bitcoin Data Shows Whales Are Buying the Dip,2021-01-11
"Bitcoin Makes History With $50,000 All-Time High",2021-02-16
Brave Is Expanding Support for Crypto DNS Providers,2021-05-26
$1.3 Billion Bitcoin Leaves Exchanges as Holders Prepare for Bull Run,2020-11-13
"Bitcoin Breaks Through $17,000, Little Resistance Ahead",2020-11-17
MicroStrategy Plans Another $690 Million Bitcoin Injection,2021-02-16
Why Bitcoin Dominance Is A Big Deal,2018-07-02
"As Fees Climb, Will Bitcoin Be Ready For Adoption?",2019-05-24
"Bitcoin at $50,000 ""Unsustainable,"" Says JP Morgan",2021-02-17
Bitcoin Takes One Step Closer to a More Scalable and Private Future,2020-10-17
Unmasking the Deceased Programmer Who Donated 28 Bitcoin to Capitol Hill Rioters,2021-01-16
Bitcoin Dip Causes $6.5 Billion in Liquidations as Analysts Consider Local Top,2021-02-22
Bitcoin Concludes Consolidation as Ethereum Hits New All-Time Highs,2021-02-03
Are Institutions Re-Opening Their Bitcoin Positions?,2020-05-07
"Square Selling Bitcoin Faster Than Can Be Mined, Supply Crisis Incoming?",2020-11-07
On-Chain Data Suggests Bitcoin's Rally Is Over for Now,2020-08-04
Mt. Gox Users Prepare to Get Back $2.6 Billion of Bitcoin,2020-12-08
$100M of Bitfinex's Stolen Bitcoin Is in Transit,2020-11-30
Formation Fi to Launch Cross-Chain AMM on Polygon,2021-05-25
"Laser Eyes Trend Storms Crypto Twitter for $100,000 BTC",2021-02-20
OnePlus Founder's Twitter Account Hacked in ICO Scam,2021-05-25
"Bitcoin Makes Headway Implementing Smart Contracts, 'Most Complicated' Part of Upgrade Complete",2020-09-13
"Bitcoin Soars Past $30,000 in Latest Record High",2021-01-02
"MicroStrategy Invests Another $175 Million in Bitcoin, Pushing Holdings to $425 Million",2020-09-15
Bitcoin Price Predictions Continue Outlandish Trend: We Measured Them In Cars.,2019-05-24
