headline,date
Bitcoin Pumps on Square's $50 Million BTC Purchase,2020-10-08
Bitcoin: The Undisputed Heavyweight Champ,2018-02-09
"Bitcoin's Recent Correction Turns Support into Resistance, Suggesting Further Losses",2020-08-12
"Bitcoin's Price Action Rhymes With 1970 Gold Markets, Says CitiBank",2020-11-14
"Fund Manager Cites ""Supply Crunch"" as Bitcoin Breaches $18,300",2020-11-19
"Returning Investors Could Push Bitcoin Past $4,000",2019-02-18
"Bitcoin Will 10X Compared to Gold, Says JP Morgan",2020-10-26
Bitcoin Rally Slows as Technicals Indicate an Imminent Bearish Correction,2020-07-30
"Bitcoin's Biggest Price Drop Since 2013, Crypto Markets in Panic",2020-03-13
"Bitcoin Finally Breaks Out, Likely Heading Toward $10,000",2020-07-21
How Companies like Apple Can Follow Tesla's Bitcoin Investment,2021-02-09
Stock Market Sell-Off Sends Bitcoin Off The Cliff,2018-10-11
Ray Dalio Now Considering a Long-Term Bitcoin Position,2021-01-28
Permissionless Bitcoin Is Back on Ethereum After Early Disaster,2020-09-23
50% of American Crypto Owners Hold Bitcoin to Fight Inflation,2020-04-23
"Bitcoin Set to Break Market Cap All-Time High at $17,500",2020-11-17
"Apple Pay Taps BitPay, Adds Bitcoin Payments",2021-02-12
Dutch Crypto Traders Forced to Explain Why They're Buying Bitcoin,2020-11-18
"Incoming: Bitcoin Price Heads Toward $9,000 As Storm Breaks",2019-05-26
Bitcoin Primed to Consolidate Before Price Movement,2021-01-26
Will Bitcoin Drag Litecoin Down During Every Dip?,2018-09-07
VanEck Takes Another Shot at Launching Bitcoin ETF,2020-12-30
"Bitcoin, Ethereum at Risk of Painful Correction After Losing Crucial Support",2021-01-27
"Bitcoin Touches $42,000 as Holders Await Higher Prices",2021-01-08
"Corporate Investments in Bitcoin, Not Inflation, Pose Real Threat to Dollar",2021-02-10
"Bitcoin, Tether Trades at 30% Discount on OKEx as Users Flee Exchange",2020-10-30
"Bitcoin Breaks $25,000, Sets New All-Time High",2020-12-26
Tesla's Elon Musk Mulls Multi-Billion Dollar Bitcoin Investment,2020-12-21
"Bitcoin Once Again Proves It's a Risk Asset, Not a Safe Haven",2020-10-02
Bitcoin and Ethereum Fundamentals Look Strong While Technicals Spell Trouble,2021-02-15
"Bitcoin Is Now Bigger Than Bank of America, Netflix, and Shopify",2020-11-06
"Trading Veteran Eyes Key Bitcoin Support, Suggests Correction Complete",2021-01-24
Morgan Stanley Investment Arm May Make Bitcoin Bet,2021-02-13
"Earn up to 8% Interest on Your Bitcoin, Ranking the Top Four Lending Services",2020-05-27
"China's Bitcoin Mining Cartel Is Finally Decentralizing to US, Russia, and Canada",2020-11-07
Institutional Investment May Be Behind Boom in Bitcoin Whale Wallets,2021-01-18
"Regulations Drive Down Bitcoin Prices, Says Research",2020-01-08
PayPal and Venmo Planning to Introduce Bitcoin Purchases?,2020-06-22
Vitalik Buterin Says Bitcoin S2F Model Is Wrong,2020-06-15
Ethereum and XRP Follow Bitcoin's Steps After Its Breakout to New Yearly Highs,2020-10-21
Bitcoin Cash Holders Dump Millions Ahead of Hard Fork,2020-11-12
Bitcoin Shows Signs as Safe-Haven Asset During Global Turmoil,2020-01-10
"Extreme Bitcoin, Ethereum Demand Add Fuel to Crypto Bull Run",2021-01-14
Microstrategy Has Officially Bought Over $1 Billion in Bitcoin,2020-12-21
Problems Abound on BSC as Bunny Finance Suffers Attack,2021-05-20
What Happens When Bitcoin Block Rewards Fall?,2019-04-23
"Tesla Reveals $1.5 Billion Bitcoin Investment, Enables BTC Payments",2021-02-08
What Is Bitcoin Cash? Introduction to BCH,2020-08-21
Venezuelan Government Plans to Regulate All Bitcoin Mining,2020-09-24
"MicroStrategy Buys Bitcoin Dip, Now Holds 70,784 BTC",2021-01-22
"U.S. Treasury Department Proposal an ""Existential Threat to Bitcoin""",2020-11-26
Ex-Microsoft Employee Charged With First-Ever Bitcoin Tax Fraud in US,2020-11-10
How Many Satoshis Are in a Bitcoin?,2020-06-20
Will the Fed's Easy Money Flow to Bitcoin?,2020-03-25
"7 Months Later, Was Bitcoin's Halving Priced In?",2020-12-02
Bitcoin and Ethereum Must Fight Post-ATH Sell-Offs,2020-12-21
Does Bitcoin Cash Deserve A Billion Dollar Valuation?,2018-06-29
Bitcoin SV Exploit Results in Widespread Theft,2020-11-09
"Bitcoin Hits $12,000, Ethereum and XRP Breakout",2020-08-17
Stacking Sats? Here Are Nine Ways to Earn Bitcoin in 2020,2020-06-17
Bitcoin Buying Pressure at Record Highs as Billionaires Search for Dollar Hedge,2020-11-18
Fifth Largest Bitcoin Exchange Bithumb Raided by South Korean Police,2020-09-03
8 Bitcoin Achievements That Prove 2018 Was Not Entirely Crap,2018-12-18
eBay Shoppers Can Now Earn Free Bitcoin This Christmas,2020-11-25
Coinbase Saved Micostrategy $4.25M Executing Firm's Bitcoin Trades,2020-12-01
"Bitcoin, Ethereum Crash Liquidates $1.1 Billion Leveraged Traders",2021-01-04
"Bitcoin Dominates Crypto by Brand Recognition, Says FCA Survey",2020-06-30
"Fitness Guru Jillian Michaels Backs Cardano, Dogecoin",2021-05-20
Ethereum Miners Earn Record $110M Amid ETH Crash,2021-05-21
"Celo Hard Fork Adds Interoperability with Solana, Cosmos, NEAR",2021-05-19
ZRXUSD Archives,2021-05-26
Uniswap to Launch on Layer 2 Solution Arbitrum,2021-03-26
"Polygon Releases SDK Eyeing ""Multi-Chain Future""",2021-05-26
"Fox Unveils NFT Company, Blockchain Creative Labs",2021-05-18
GameStop to Build NFT Platform on Ethereum,2021-05-26
Indonesia to Launch Central Bank Digital Currency,2021-05-25
U.S. Government Calls for Information on EtherDelta Hack,2021-05-21
Red Bull Racing Team to Use Tezos for First NFT Drop,2021-05-20
Sushi to Sell Tokenized Sake on Initial Offering Launchpad,2021-05-18
Another Binance Smart Chain Project Suffers an Attack,2021-05-24
Judge Allows SEC to Seek Info on Ripple's Overseas XRP Transactions,2021-05-20
Stablecoins Surpass $100 Billion Market Cap,2021-05-26
"SEC Investigating Ripple's XRP ""Lobbying Efforts""",2019-10-02
"Enjin Airdrops 50,000 NFTs via Social Media QR Adverts",2021-05-26
Carl Icahn Archives,2021-05-01
arbitrum Archives,2021-05-01
Kevin O'Leary Archives,2021-05-01
Crypto Briefing,2021-05-24
